B1: =COUNTIF(B3:B70,">0") -> 9 | C1: =COUNTIF(C3:C70,">0") -> 4 | D1: =COUNTIF(D3:D70,">0") -> 7 | E1: =COUNTIF(E3:E70,">0") -> 7 | F1: =COUNTIF(F3:F70,">0") -> 4 | G1: =COUNTIF(G3:G70,">0") -> 7 | H1: =COUNTIF(H3:H70,">0") -> 7 | I1: =COUNTIF(I3:I70,">0") -> 4 | J1: =COUNTIF(J3:J70,">0") -> 7 | K1: =COUNTIF(K3:K70,">0") -> 7
C2: 12 | D2: 12А | E2: 12Б | F2: 13 | G2: 13А | H2: 13Б | I2: 14 | J2: 14А | K2: 14Б
A3: 42772
A4: 42773
A5: 42774 | I5: 311 | L5: 311- 10:20
A6: 42775 | B6: 411 | L6: 0411 - 12:20
A7: 42776 | C7: 309 | E7: 246 | F7: 310 | L7: 310 - 08:30 309 - 10:20 246 - 12:20
A8: 42777
A9: 42778
A10: 42779 | G10: 246
A11: 42780 | J11: 246
A12: 42781 | I12: 311 | L12: 311- 10:20
A13: 42782 | B13: 411 | L13: 0411 - 12:20
A14: 42783 | C14: 309 | D14: 246 | F14: 310 | L14: 310 - 08:30 309 - 10:20 246 - 12:20
A15: 42784
A16: 42785
A17: 42786 | H17: 246
A18: 42787 | K18: 246
A19: 42788 | I19: 311 | L19: 311- 10:20
A20: 42789
A21: 42790
A22: 42791
A23: 42792
A24: 42793 | G24: 246
A25: 42794 | J25: 246
A26: 42795 | I26: 311 | L26: 311- 10:20
A27: 42796 | B27: 411 | L27: 0411 - 12:20
A28: 42797 | C28: 309 | E28: 246 | F28: 310 | L28: 310 - 08:30 309 - 10:20 246 - 12:20
A29: 42798
A30: 42799
A31: 42800 | H31: 246
A32: 42801 | K32: 246
A33: 42802
A34: 42803 | B34: 411 | L34: 0411 - 12:20
A35: 42804 | C35: 309 | D35: 246 | F35: 310 | L35: 310 - 08:30 309 - 10:20 246 - 12:20
A36: 42805
A37: 42806
A38: 42807 | G38: 246
A39: 42808 | J39: 246
A40: 42809 | K40: 246
A41: 42810 | B41: 411 | H41: 246 | L41: 0411 - 12:20
A42: 42811 | D42: 246 | E42: 246 | L42: А - 08:30 Б - 12:20
A43: 42812
A44: 42813
A45: 42814 | H45: 246
A46: 42815 | K46: 246
A47: 42816 | J47: 246
A48: 42817 | B48: 411 | G48: 246 | L48: 0411 - 12:20
A49: 42818 | D49: 246 | E49: 246 | L49: Б - 08:30 А - 12:20
A50: 42819
A51: 42820
A52: 42821 | G52: 246
A53: 42822 | J53: 246
A54: 42823 | K54: 246
A55: 42824 | B55: 411 | H55: 246 | L55: 0411 - 12:20
A56: 42825 | D56: 246 | E56: 246 | L56: А - 08:30 Б - 12:20
A57: 42826
A58: 42827
A59: 42828 | H59: 246
A60: 42829 | K60: 246
A61: 42830 | J61: 246
A62: 42831 | B62: 411 | G62: 246 | L62: 0411 - 12:20
A63: 42832 | D63: 246 | E63: 246 | L63: Б - 08:30 А - 12:20
A64: 42833
A65: 42834
A66: 42835 | G66: 246
A67: 42836 | J67: 246
A68: 42837 | K68: 246
A69: 42838 | B69: 411 | H69: 246 | L69: 0411 - 12:20
A70: 42839 | D70: 246 | E70: 246 | L70: А - 08:30 Б - 12:20